{
  "schemaVersion": 1,
  "artifactKind": "datapack-release-request",
  "candidateId": "capital-pilot-candidate-20260712",
  "scopeId": "capital_pilot_android_v1",
  "buildSpecSha256": "daf4158fd90a942347de0111ab36ae923025e07fee3457d37612d26b02ad7a09",
  "sourceSnapshotSetHash": "2ac2077a311af35f341275931ff6dce82873d59a4814779c586b59ea63d3462e",
  "approvedLedgerHash": "9a74e31d64e53f38ab575d6a7731f72138523dd34f1f6756dbed8573e3bdeabc",
  "requestedBy": "claude-fable-orchestrator",
  "approvedBy": "aquilaXk10",
  "approvalId": "release-request-2026-07-26-01",
  "targetChannel": "production"
}
